Restaurent name,Cuisine types,Rating,Price,Distance,Location,what_people_like_about_us,textual_features
Skyhilton,"North Indian, Chinese, Continental, Oriental, Kebab, Fast Food, Desserts, Beverages",4.4,900.0,8.7,"Alambagh, Lucknow","Trendy Setting, Vintage Decor, Flavorful Creations","North Indian, Chinese, Continental, Oriental, Kebab, Fast Food, Desserts, Beverages Trendy Setting, Vintage Decor, Flavorful Creations"
Hooters,"Burger, Pizza, Chinese, Continental",3.5,150.0,11.0,"Aashiana, Lucknow","Courteous Staff, Exquisite Taste, Perfect Place","Burger, Pizza, Chinese, Continental Courteous Staff, Exquisite Taste, Perfect Place"
Shawarma Wala,"Shawarma, Fast Food",3.8,150.0,5.1,"Aliganj, Lucknow","Customizable Dishes, Exquisite Taste, Weekend Brunch","Shawarma, Fast Food Customizable Dishes, Exquisite Taste, Weekend Brunch"
KFC,"Burger, Fast Food, Biryani, Desserts, Beverages",3.8,275.0,9.0,"Phoenix United Mall, Alambagh, Lucknow","Memorable Experience, Vintage Decor, Great for Dates","Burger, Fast Food, Biryani, Desserts, Beverages Memorable Experience, Vintage Decor, Great for Dates"
Furrytales Cafe,"Beverages, Street Food, Fast Food, Chinese, Ice Cream",2.6,175.0,4.5,"Gomti Nagar, Lucknow","Great Service, Attentive Service, Hospitable Staff","Beverages, Street Food, Fast Food, Chinese, Ice Cream Great Service, Attentive Service, Hospitable Staff"
Black Brew House,"North Indian, Continental, Italian, Asian, Fast Food, Beverages, Desserts",4.2,700.0,6.1,"Summit Building, Gomti Nagar, Lucknow","Customizable Dishes, Diverse Menu, Efficient Service","North Indian, Continental, Italian, Asian, Fast Food, Beverages, Desserts Customizable Dishes, Diverse Menu, Efficient Service"
Roastery Coffee House,"Cafe, American, Continental, Italian, Pizza, Fast Food, Desserts, Beverages",4.6,475.0,5.0,"Gomti Nagar, Lucknow","Inviting Decor, Cafe, Live Sports Screening","Cafe, American, Continental, Italian, Pizza, Fast Food, Desserts, Beverages Inviting Decor, Cafe, Live Sports Screening"
Get Your Burger,"Burger, Sandwich, Fast Food, Street Food, Coffee, Shake, Beverages",3.5,200.0,7.2,"Sadar Bazaar, Lucknow","Diverse Menu, Staff, Cafe","Burger, Sandwich, Fast Food, Street Food, Coffee, Shake, Beverages Diverse Menu, Staff, Cafe"
Punjab Grill,"North Indian, Mughlai, Kebab, Biryani, Desserts",4.6,1250.0,8.8,"Gomti Nagar, Lucknow","Cafe, Courteous Staff, Breakfast","North Indian, Mughlai, Kebab, Biryani, Desserts Cafe, Courteous Staff, Breakfast"
Masaki Cafe Couture,"Bakery, Italian, Mexican, Fast Food, Asian, Desserts, Juices, Beverages",4.3,600.0,1.7,"Hazratganj, Lucknow","Efficient Service, Diverse Menu, Good Bartenders","Bakery, Italian, Mexican, Fast Food, Asian, Desserts, Juices, Beverages Efficient Service, Diverse Menu, Good Bartenders"
Royal Train Cuisine - RTC,"North Indian, South Indian",3.0,500.0,5.3,"Gomti Nagar, Lucknow","Sophisticated, Cozy Ambiance, Peaceful Ambience","North Indian, South Indian Sophisticated, Cozy Ambiance, Peaceful Ambience"
MERAKI the Bistro,"North Indian, Chinese, Italian, Pizza, Continental, Biryani, Desserts, Bar Food",3.6,800.0,9.9,"Gomti Nagar, Lucknow","Breakfast, Extensive Mocktail Menu, Brewed Beer","North Indian, Chinese, Italian, Pizza, Continental, Biryani, Desserts, Bar Food Breakfast, Extensive Mocktail Menu, Brewed Beer"
10th Goodness,"Pizza, Bakery, Fast Food, Beverages",3.7,125.0,8.3,"Gomti Nagar, Lucknow","Good Music, Fresh Ingredients, Inviting Decor","Pizza, Bakery, Fast Food, Beverages Good Music, Fresh Ingredients, Inviting Decor"
Ishaara,"North Indian, Mughlai, Seafood, Biryani, Pizza, Fast Food, Street Food, Desserts",4.5,1000.0,8.8,"Phoenix Plassio Mall, Lucknow","Courteous Staff, Flavorful Creations, Ambiance","North Indian, Mughlai, Seafood, Biryani, Pizza, Fast Food, Street Food, Desserts Courteous Staff, Flavorful Creations, Ambiance"
Purple Basil,"North Indian, Sandwich, Pizza, Sushi, Italian, Fast Food, Mexican, Salad",4.4,550.0,9.2,"Gomti Nagar, Lucknow","Quantity, Courteous Staff, Clean Environment","North Indian, Sandwich, Pizza, Sushi, Italian, Fast Food, Mexican, Salad Quantity, Courteous Staff, Clean Environment"
Barbeque Nation,"North Indian, BBQ, Biryani, Kebab, Continental, Chinese, Beverages, Desserts",4.3,950.0,3.3,"Aliganj, Lucknow","Brewed Beer, Warm Atmosphere, Hospitable Staff","North Indian, BBQ, Biryani, Kebab, Continental, Chinese, Beverages, Desserts Brewed Beer, Warm Atmosphere, Hospitable Staff"
Mamagoto,"Asian, Sushi, Japanese, Thai, Chinese, Salad, Desserts",4.6,900.0,2.6,"Riverside Mall, Gomti Nagar, Lucknow","Great Service, Comfortable Seating, Impeccable Presentation","Asian, Sushi, Japanese, Thai, Chinese, Salad, Desserts Great Service, Comfortable Seating, Impeccable Presentation"
The Terrace,"North Indian, Pizza, Salad, Fast Food, Street Food, Desserts, Beverages",4.0,850.0,1.6,"Hazratganj, Lucknow","Staff, Seasonal Menu, Innovative Dishes","North Indian, Pizza, Salad, Fast Food, Street Food, Desserts, Beverages Staff, Seasonal Menu, Innovative Dishes"
Fashiontv Cafe,"Cafe, Coffee, Pizza, Fast Food, Continental, Beverages",3.6,500.0,6.0,"Gomti Nagar, Lucknow","Sophisticated, Sustainable Practices, Good Bartenders","Cafe, Coffee, Pizza, Fast Food, Continental, Beverages Sophisticated, Sustainable Practices, Good Bartenders"
Dobaraa,"Cafe, Coffee, Salad, Continental, Pizza, North Indian, Asian",4.1,850.0,8.8,"Phoenix Plassio Mall, Lucknow","Vintage Decor, Memorable Experience, Ambiance","Cafe, Coffee, Salad, Continental, Pizza, North Indian, Asian Vintage Decor, Memorable Experience, Ambiance"
Mr. Brown - Danbro,"Bakery, Desserts, Pizza, Fast Food, Street Food, Beverages",4.2,250.0,4.1,"Aliganj, Lucknow","Creative Cuisine, Ambience, Diverse Menu","Bakery, Desserts, Pizza, Fast Food, Street Food, Beverages Creative Cuisine, Ambience, Diverse Menu"
Shri Balaji Dhaba,"South Indian, Chinese, North Indian, Fast Food, Street Food, Biryani",3.9,150.0,10.3,"Transport Nagar, Lucknow","Efficient Service, Sophisticated, Memorable Experience","South Indian, Chinese, North Indian, Fast Food, Street Food, Biryani Efficient Service, Sophisticated, Memorable Experience"
Bellezza,"North Indian, Chinese, Mughlai, Biryani, Salad, Shake, Beverages",3.6,500.0,7.9,"Gomti Nagar, Lucknow","Inviting Decor, Great Service, Comfortable Seating","North Indian, Chinese, Mughlai, Biryani, Salad, Shake, Beverages Inviting Decor, Great Service, Comfortable Seating"
Chicago Pizza,"Pizza, Pasta, Fast Food, Beverages",3.6,200.0,7.1,"Gomti Nagar, Lucknow","Diverse Menu, Customizable Dishes, Good Bartenders","Pizza, Pasta, Fast Food, Beverages Diverse Menu, Customizable Dishes, Good Bartenders"
Pizza Pool,"Pizza, Fast Food, Burger, Pasta",4.2,150.0,7.1,"Rajajipuram, Lucknow","Quantity, Sophisticated, Sustainable Practices","Pizza, Fast Food, Burger, Pasta Quantity, Sophisticated, Sustainable Practices"
The Drowning Street,"North Indian, Chinese, Continental, Fast Food, Desserts, Beverages",4.3,850.0,6.2,"Gomti Nagar, Lucknow","Perfect Place, Sophisticated, Exquisite Taste","North Indian, Chinese, Continental, Fast Food, Desserts, Beverages Perfect Place, Sophisticated, Exquisite Taste"
Distillery,"North Indian, Chinese, Italian, Street Food, BBQ, Finger Food, Desserts, Beverages",4.1,950.0,6.0,"Summit Building, Gomti Nagar, Lucknow","Exquisite Taste, Attentive Service, Cafe","North Indian, Chinese, Italian, Street Food, BBQ, Finger Food, Desserts, Beverages Exquisite Taste, Attentive Service, Cafe"
Chow & Fit Meals,"Chinese, Healthy Food",3.4,150.0,6.1,"Gomti Nagar, Lucknow","Main Course, Efficient Service, Courteous Staff","Chinese, Healthy Food Main Course, Efficient Service, Courteous Staff"
Black Town Cafe,Chinese,3.6,250.0,10.7,"Gomti Nagar, Lucknow","Variety of Beer, Courteous Staff, Main Course","Chinese Variety of Beer, Courteous Staff, Main Course"
Cakes 555,"Bakery, Pizza, Sandwich, Burger, Beverages",3.8,125.0,8.3,"Gomti Nagar, Lucknow","Extensive Mocktail Menu, Great Service, Memorable Experience","Bakery, Pizza, Sandwich, Burger, Beverages Extensive Mocktail Menu, Great Service, Memorable Experience"
Purvanchal Handi Hut - Ashiyana,"North Indian, Mughlai, Bihari, Biryani, Rolls, Fast Food, Desserts",3.6,175.0,9.5,"Aashiana, Lucknow","Efficient Service, Great for Dates, Main Course","North Indian, Mughlai, Bihari, Biryani, Rolls, Fast Food, Desserts Efficient Service, Great for Dates, Main Course"
Burger King,"Burger, Fast Food, Desserts, Beverages",4.5,175.0,9.0,"Phoenix United Mall, Alambagh, Lucknow","Great Service, Perfect Place, Great for Dates","Burger, Fast Food, Desserts, Beverages Great Service, Perfect Place, Great for Dates"
ZAO,"Asian, Chinese, Japanese, Korean, Thai, Sushi, Sichuan, Desserts",4.8,900.0,6.0,"Cyber Heights, Gomti Nagar, Lucknow","Main Course, Hospitable Staff, Staff","Asian, Chinese, Japanese, Korean, Thai, Sushi, Sichuan, Desserts Main Course, Hospitable Staff, Staff"
Olivas Pizzeria,"Pizza, Italian, Fast Food, Beverages",4.4,475.0,4.6,"Gomti Nagar, Lucknow","Great Service, Brewed Beer, Ambience","Pizza, Italian, Fast Food, Beverages Great Service, Brewed Beer, Ambience"
Balaji Ka Dhaba,"North Indian, South Indian",3.9,175.0,6.9,"Alambagh, Lucknow","Well-priced Options, Flavorful Creations, Hospitable Staff","North Indian, South Indian Well-priced Options, Flavorful Creations, Hospitable Staff"
Lord of the Drinks,"North Indian, Chinese, Continental, Pizza, Pasta",4.5,1250.0,1.9,"Nirala Nagar, Lucknow","Great Service, Ambience, Satisfying Portions","North Indian, Chinese, Continental, Pizza, Pasta Great Service, Ambience, Satisfying Portions"
The Fancave,"Cafe, Continental, Fast Food, Healthy Food, Tex-Mex, Italian, Mexican, Desserts",4.9,650.0,10.4,"Gomti Nagar, Lucknow","Great for Dates, Young Crowd, Great Service","Cafe, Continental, Fast Food, Healthy Food, Tex-Mex, Italian, Mexican, Desserts Great for Dates, Young Crowd, Great Service"
Romeo Lane,"Chinese, Biryani, Italian, North Indian, Asian, Oriental, Desserts, Beverages",3.6,950.0,6.1,"Gomti Nagar, Lucknow","Extensive Mocktail Menu, Authentic Flavors, Exquisite Taste","Chinese, Biryani, Italian, North Indian, Asian, Oriental, Desserts, Beverages Extensive Mocktail Menu, Authentic Flavors, Exquisite Taste"
Legend Inn,"North Indian, South Indian, Chinese, Pizza, Momos, Mughlai, Fast Food, Salad",4.3,600.0,7.3,"Gomti Nagar, Lucknow","Young Crowd, Extensive Mocktail Menu, Seasonal Menu","North Indian, South Indian, Chinese, Pizza, Momos, Mughlai, Fast Food, Salad Young Crowd, Extensive Mocktail Menu, Seasonal Menu"
On High - Hotel Silvete,"North Indian, Chinese, Biryani, Mughlai, Italian, Continental, Desserts, Beverages",4.3,900.0,1.0,"Hazratganj, Lucknow","Great Service, Cafe, Staff","North Indian, Chinese, Biryani, Mughlai, Italian, Continental, Desserts, Beverages Great Service, Cafe, Staff"
Spice Caves,"North Indian, Chinese, Mughlai, BBQ, Sichuan, Biryani, Fast Food, Ice Cream",4.3,850.0,4.9,"Gomti Nagar, Lucknow","Breakfast, Consistent Quality, Efficient Service","North Indian, Chinese, Mughlai, BBQ, Sichuan, Biryani, Fast Food, Ice Cream Breakfast, Consistent Quality, Efficient Service"
Awadh Grill,"North Indian, Roast Chicken, Burger, Wraps, Fast Food, Beverages",3.9,600.0,6.0,"Gomti Nagar, Lucknow","Ambience, Consistent Quality, Efficient Service","North Indian, Roast Chicken, Burger, Wraps, Fast Food, Beverages Ambience, Consistent Quality, Efficient Service"
Lord of The Drinks,"North Indian, Chinese, Continental, Pizza, Pasta, Fast Food, Beverages",4.4,1500.0,6.2,"Gomti Nagar, Lucknow","Ambiance, Customizable Dishes, Perfect Place","North Indian, Chinese, Continental, Pizza, Pasta, Fast Food, Beverages Ambiance, Customizable Dishes, Perfect Place"
Keventers - Milkshakes & Desserts,"Beverages, Shake",3.9,175.0,1.2,"Hazratganj, Lucknow","Courteous Staff, Good Music, Flavorful Creations","Beverages, Shake Courteous Staff, Good Music, Flavorful Creations"
Leto,"Sushi, Sandwich, Salad, European, Coffee, Japanese, Italian, Beverages",3.6,700.0,3.7,"Aliganj, Lucknow","Delicious Food, Diverse Menu, Warm Atmosphere","Sushi, Sandwich, Salad, European, Coffee, Japanese, Italian, Beverages Delicious Food, Diverse Menu, Warm Atmosphere"
Crunch Patty,"Cafe, Coffee, Fast Food, Pizza, Sandwich, Beverages",3.6,250.0,6.1,"Jankipuram, Lucknow","Ambiance, Ambience, Creative Cuisine","Cafe, Coffee, Fast Food, Pizza, Sandwich, Beverages Ambiance, Ambience, Creative Cuisine"
Butter Story,"Bakery, Pasta, Italian, Wraps, Sandwich, Desserts, Beverages",3.4,175.0,2.3,"Aliganj, Lucknow","Memorable Experience, Satisfying Portions, Efficient Service","Bakery, Pasta, Italian, Wraps, Sandwich, Desserts, Beverages Memorable Experience, Satisfying Portions, Efficient Service"
Pizza Hut,"Pizza, Pasta, Italian, Desserts, Beverages",3.6,300.0,1.3,"Mahanagar, Lucknow","Impeccable Presentation, Comfortable Seating, Brewed Beer","Pizza, Pasta, Italian, Desserts, Beverages Impeccable Presentation, Comfortable Seating, Brewed Beer"
Highway Food's,"North Indian, Mughlai, Chinese, Fast Food, Shake, Street Food",3.2,250.0,6.5,"Gomti Nagar, Lucknow","Quantity, Creative Cuisine, Customizable Dishes","North Indian, Mughlai, Chinese, Fast Food, Shake, Street Food Quantity, Creative Cuisine, Customizable Dishes"
Mocha,"Italian, Continental, North Indian, Fast Food, Desserts, Beverages",4.4,900.0,5.2,"Anand Plaza, Patkapuram, Gomti Nagar, Lucknow","Cozy Ambiance, Variety of Beer, Innovative Dishes","Italian, Continental, North Indian, Fast Food, Desserts, Beverages Cozy Ambiance, Variety of Beer, Innovative Dishes"
The Pizza House,"Pizza, Fast Food, Street Food, Shake",3.9,150.0,7.9,"Chowk, Lucknow","Attentive Service, Consistent Quality, Efficient Service","Pizza, Fast Food, Street Food, Shake Attentive Service, Consistent Quality, Efficient Service"
Pirates of Grill,"North Indian, BBQ, Chinese, Asian, Mughlai, Salad, Oriental, Desserts",4.6,1250.0,6.0,"Cyber Heights, Gomti Nagar, Lucknow","Trendy Setting, Memorable Experience, Seasonal Menu","North Indian, BBQ, Chinese, Asian, Mughlai, Salad, Oriental, Desserts Trendy Setting, Memorable Experience, Seasonal Menu"
Tonique Bistro & Bar,"North Indian, Mughlai, Italian, Asian, Fast Food, Biryani, Bar Food, Desserts",3.9,900.0,5.2,"Phoenix Plassio Mall, Lucknow","Friendly Staff, Great for Dates, Memorable Experience","North Indian, Mughlai, Italian, Asian, Fast Food, Biryani, Bar Food, Desserts Friendly Staff, Great for Dates, Memorable Experience"
Wat-a-Burger! - India ka Burger,"Burger, Wraps, Fast Food, Desserts, Sandwich, Beverages",3.8,200.0,1.9,"Hazratganj, Lucknow","Courteous Staff, Extensive Mocktail Menu, Memorable Experience","Burger, Wraps, Fast Food, Desserts, Sandwich, Beverages Courteous Staff, Extensive Mocktail Menu, Memorable Experience"
Momo King,"Chinese, Momos, Rolls, Beverages",4.2,250.0,2.4,"Aliganj, Lucknow","Delicious Food, Hospitality, Well-priced Options","Chinese, Momos, Rolls, Beverages Delicious Food, Hospitality, Well-priced Options"
La Sani'z Biryani,"Biryani, Lebanese, North Indian, Beverages",3.7,200.0,9.3,"Aashiana, Lucknow","Local Sourcing, Satisfying Portions, Young Crowd","Biryani, Lebanese, North Indian, Beverages Local Sourcing, Satisfying Portions, Young Crowd"
Nainital Momos,"Momos, Chinese, Street Food, Beverages, Shake",4.1,175.0,10.2,"Aashiana, Lucknow","Consistent Quality, Good Music, Satisfying Portions","Momos, Chinese, Street Food, Beverages, Shake Consistent Quality, Good Music, Satisfying Portions"
Burger Singh - Big Punjabi Burgers,"Burger, Fast Food, Momos, Beverages",3.6,200.0,5.0,"Aliganj, Lucknow","Hospitable Staff, Consistent Quality, Fresh Ingredients","Burger, Fast Food, Momos, Beverages Hospitable Staff, Consistent Quality, Fresh Ingredients"
The Chocolate Room,"Bakery, Cafe, Coffee, Salad, Italian, Fast Food, Chinese, Mexican",4.1,450.0,1.6,"Hazratganj, Lucknow","Authentic Flavors, Variety of Beer, Exquisite Taste","Bakery, Cafe, Coffee, Salad, Italian, Fast Food, Chinese, Mexican Authentic Flavors, Variety of Beer, Exquisite Taste"
Cafe Delhi Heights,"Continental, North Indian, Chinese, Street Food, Fast Food, Seafood, Desserts, Beverages",4.6,750.0,2.6,"Riverside Mall, Gomti Nagar, Lucknow","Trendy Setting, Peaceful Ambience, Clean Environment","Continental, North Indian, Chinese, Street Food, Fast Food, Seafood, Desserts, Beverages Trendy Setting, Peaceful Ambience, Clean Environment"
Kake Di Hatti,"Chinese, North Indian, Pizza, Italian, Desserts, Beverages, Cake",4.2,475.0,6.2,"Gomti Nagar, Lucknow","Ambiance, Peaceful Ambience, Sophisticated","Chinese, North Indian, Pizza, Italian, Desserts, Beverages, Cake Ambiance, Peaceful Ambience, Sophisticated"
Foodie,"North Indian, Mughlai, South Indian, Chinese, Fast Food, Biryani, Beverages",3.8,600.0,12.0,"Gomti Nagar, Lucknow","Cozy Ambiance, Hospitality, Great for Dates","North Indian, Mughlai, South Indian, Chinese, Fast Food, Biryani, Beverages Cozy Ambiance, Hospitality, Great for Dates"
The Diamond Pizza & Chinese Point,"Chinese, North Indian, Pizza, Burger, Fast Food",3.8,150.0,6.3,"Jankipuram, Lucknow","Exquisite Taste, Ambiance, Flavorful Creations","Chinese, North Indian, Pizza, Burger, Fast Food Exquisite Taste, Ambiance, Flavorful Creations"
Pizzatarian,"Pizza, Pasta, Fast Food, Burger, Wraps, Rolls, American",3.9,300.0,0.953,"Jankipuram, Lucknow","Trendy Setting, Innovative Dishes, Breakfast","Pizza, Pasta, Fast Food, Burger, Wraps, Rolls, American Trendy Setting, Innovative Dishes, Breakfast"
Spice Sutra,"North Indian, Fast Food, Chinese, Continental, Mughlai, Pizza, Desserts, Beverages",4.4,425.0,7.1,"Gomti Nagar, Lucknow","Friendly Staff, Seasonal Menu, Breakfast","North Indian, Fast Food, Chinese, Continental, Mughlai, Pizza, Desserts, Beverages Friendly Staff, Seasonal Menu, Breakfast"
Delhi Choti Line Restaurant And Cafe,"North Indian, Mughlai",3.3,200.0,4.9,"Jankipuram, Lucknow","Great for Dates, Great Service, Well-priced Options","North Indian, Mughlai Great for Dates, Great Service, Well-priced Options"
Burger Point,"Fast Food, Burger, Beverages",4.0,150.0,5.2,"Aliganj, Lucknow","Attentive Service, Quantity, Good Bartenders","Fast Food, Burger, Beverages Attentive Service, Quantity, Good Bartenders"
Cafe Hons - House Of No Sugar,"Italian, Mexican, Continental, Sandwich, Burger, Fast Food, Beverages",4.5,600.0,6.0,"Gomti Nagar, Lucknow","Satisfying Portions, Attentive Service, Variety of Beer","Italian, Mexican, Continental, Sandwich, Burger, Fast Food, Beverages Satisfying Portions, Attentive Service, Variety of Beer"
D' Cafe Caribbean,"North Indian, Chinese, Sandwich, Pizza, Desserts, Mughlai, Juices, Shake",3.6,500.0,2.7,"Husain Ganj, Lucknow","Quantity, Cozy Ambiance, Ambience","North Indian, Chinese, Sandwich, Pizza, Desserts, Mughlai, Juices, Shake Quantity, Cozy Ambiance, Ambience"
Pizza Tavola,"Pizza, Pasta, Sandwich, Fast Food, Tea, Shake, Desserts, Beverages",4.6,425.0,3.6,"Indira Nagar, Lucknow","Young Crowd, Sustainable Practices, Exquisite Taste","Pizza, Pasta, Sandwich, Fast Food, Tea, Shake, Desserts, Beverages Young Crowd, Sustainable Practices, Exquisite Taste"
Falak Numa Restaurant - Hotel Clarks Avadh,"North Indian, Lucknowi, Awadhi, Desserts, Beverages",3.9,1750.0,1.7,"Hotel Clarks Avadh, Hazratganj, Lucknow","Peaceful Ambience, Fresh Ingredients, Diverse Menu","North Indian, Lucknowi, Awadhi, Desserts, Beverages Peaceful Ambience, Fresh Ingredients, Diverse Menu"
Hum Tum Bun Tea,"Chinese, Pizza, Sandwich, Fast Food, Street Food, Tea, Coffee",3.6,175.0,5.7,"Gomti Nagar, Lucknow","Vintage Decor, Exquisite Taste, Consistent Quality","Chinese, Pizza, Sandwich, Fast Food, Street Food, Tea, Coffee Vintage Decor, Exquisite Taste, Consistent Quality"
Domino's Pizza,"Pizza, Italian, Pasta, Fast Food, Desserts",3.8,200.0,5.3,"Aliganj, Lucknow","Authentic Flavors, Great Service, Efficient Service","Pizza, Italian, Pasta, Fast Food, Desserts Authentic Flavors, Great Service, Efficient Service"
Jannat-Dayal Paradise,"Italian, Continental, Finger Food, Desserts",4.0,700.0,4.7,"Hotel Dayal Paradise, Gomti Nagar, Lucknow","Great Service, Clean Environment, Extensive Mocktail Menu","Italian, Continental, Finger Food, Desserts Great Service, Clean Environment, Extensive Mocktail Menu"
Upper Deck - Restro Bar,"North Indian, Chinese, Mughlai, Biryani, Sandwich, Pizza, Fast Food",3.9,550.0,5.2,"Jankipuram, Lucknow","Hospitality, Good Bartenders, Exquisite Taste","North Indian, Chinese, Mughlai, Biryani, Sandwich, Pizza, Fast Food Hospitality, Good Bartenders, Exquisite Taste"
Burger Bong,"Burger, Chinese, Pizza, Momos, Rolls, Fast Food",3.6,125.0,4.6,"Gomti Nagar, Lucknow","Cozy Ambiance, Ambiance, Creative Cuisine","Burger, Chinese, Pizza, Momos, Rolls, Fast Food Cozy Ambiance, Ambiance, Creative Cuisine"
The Kalika Hut,"North Indian, Chinese, Mughlai, Fast Food",3.0,250.0,1.7,"Hazratganj, Lucknow","Good Music, Efficient Service, Seasonal Menu","North Indian, Chinese, Mughlai, Fast Food Good Music, Efficient Service, Seasonal Menu"
La Pino'z Pizza,"Pizza, Pasta, Italian, Fast Food",3.9,400.0,4.2,"Chowk, Lucknow","Diverse Menu, Innovative Dishes, Trendy Setting","Pizza, Pasta, Italian, Fast Food Diverse Menu, Innovative Dishes, Trendy Setting"
Hons  All Day Dining,"Cafe, Coffee, Tea, Shake, Beverages, Continental, Italian, Salad",4.0,300.0,1.6,"Hazratganj, Lucknow","Cafe, Ambience, Impeccable Presentation","Cafe, Coffee, Tea, Shake, Beverages, Continental, Italian, Salad Cafe, Ambience, Impeccable Presentation"
Firefly,"North Indian, South Indian, Chinese, Italian, Thai, Japanese, Beverages, Desserts",4.0,950.0,6.1,"Summit Building, Gomti Nagar, Lucknow","Inviting Decor, Customizable Dishes, Trendy Setting","North Indian, South Indian, Chinese, Italian, Thai, Japanese, Beverages, Desserts Inviting Decor, Customizable Dishes, Trendy Setting"
Hudson Chopsticks,"Chinese, Thai, Asian, Fast Food, Beverages, Desserts",4.4,500.0,5.7,"Gomti Nagar, Lucknow","Clean Environment, Authentic Flavors, Weekend Brunch","Chinese, Thai, Asian, Fast Food, Beverages, Desserts Clean Environment, Authentic Flavors, Weekend Brunch"
Giani,"Desserts, Ice Cream",3.6,100.0,1.2,"Sapru Marg, Lucknow","Efficient Service, Delicious Food, Good Music","Desserts, Ice Cream Efficient Service, Delicious Food, Good Music"
Bae House Cafe,"Cafe, Coffee, Pizza, North Indian, Chinese, Fast Food, Desserts, Beverages",3.6,350.0,5.6,"Gomti Nagar, Lucknow","Great Service, Exquisite Taste, Peaceful Ambience","Cafe, Coffee, Pizza, North Indian, Chinese, Fast Food, Desserts, Beverages Great Service, Exquisite Taste, Peaceful Ambience"
The Square - Novotel,"North Indian, Mughlai, Oriental, Continental, Fast Food, Desserts",4.2,1750.0,7.5,"Novotel, Gomti Nagar, Lucknow","Variety of Beer, Creative Cuisine, Trendy Setting","North Indian, Mughlai, Oriental, Continental, Fast Food, Desserts Variety of Beer, Creative Cuisine, Trendy Setting"
Azrak- Saraca Lucknow,"Chinese, Fast Food, Street Food, North Indian, Kebab, Mughlai, Biryani, Desserts",4.3,1750.0,3.4,"lebua Lucknow, Lucknow","Sophisticated, Memorable Experience, Flavorful Creations","Chinese, Fast Food, Street Food, North Indian, Kebab, Mughlai, Biryani, Desserts Sophisticated, Memorable Experience, Flavorful Creations"
Firdaus - Deep Palace,"North Indian, Chinese, South Indian, Continental, Desserts, Beverages",3.9,600.0,3.4,"Deep Palace, Udaiganj, Lucknow","Hospitality, Comfortable Seating, Well-priced Options","North Indian, Chinese, South Indian, Continental, Desserts, Beverages Hospitality, Comfortable Seating, Well-priced Options"
Destination Lucknow,"North Indian, Mughlai, Biryani",4.0,250.0,4.4,"Indira Nagar, Lucknow","Good Music, Cozy Ambiance, Hospitable Staff","North Indian, Mughlai, Biryani Good Music, Cozy Ambiance, Hospitable Staff"
Fauji Da Dhaba,"North Indian, Chinese, South Indian, Street Food",3.3,125.0,8.9,"Gomti Nagar, Lucknow","Ambience, Good Music, Staff","North Indian, Chinese, South Indian, Street Food Ambience, Good Music, Staff"
Al-Baik,"Fast Food, Burger",4.2,150.0,4.3,"Chowk, Lucknow","Efficient Service, Perfect Place, Authentic Flavors","Fast Food, Burger Efficient Service, Perfect Place, Authentic Flavors"
La Chakhna,"Korean, Bubble Tea, Japanese, Asian",3.3,225.0,3.2,"Aliganj, Lucknow","Sustainable Practices, Comfortable Seating, Diverse Menu","Korean, Bubble Tea, Japanese, Asian Sustainable Practices, Comfortable Seating, Diverse Menu"
Uncle Peter's Pancakes,"Waffle, Desserts, Pancake, Sandwich, Fast Food, Beverages",4.0,250.0,9.3,"Aashiana, Lucknow","Efficient Service, Breakfast, Flavorful Creations","Waffle, Desserts, Pancake, Sandwich, Fast Food, Beverages Efficient Service, Breakfast, Flavorful Creations"
Fit Food Bistro,"Chinese, Shake, Salad, Cafe, Coffee, Healthy Food, North Indian",3.2,150.0,3.2,"Aliganj, Lucknow","Well-priced Options, Impeccable Presentation, Creative Cuisine","Chinese, Shake, Salad, Cafe, Coffee, Healthy Food, North Indian Well-priced Options, Impeccable Presentation, Creative Cuisine"
Bukhara Grill,"North Indian, Continental, American, Mughlai, Chinese, Beverages",4.0,800.0,9.2,"Aashiana, Lucknow","Extensive Mocktail Menu, Sustainable Practices, Main Course","North Indian, Continental, American, Mughlai, Chinese, Beverages Extensive Mocktail Menu, Sustainable Practices, Main Course"
Balaji Grand,"North Indian, Chinese",4.0,250.0,4.2,"Charbagh, Lucknow","Variety of Beer, Brewed Beer, Extensive Mocktail Menu","North Indian, Chinese Variety of Beer, Brewed Beer, Extensive Mocktail Menu"
La Sani'z -Delight In Every Bite,"Cafe, Lebanese, Fast Food, Desserts, Beverages, Chinese",4.0,175.0,3.0,"Indira Nagar, Lucknow","Memorable Experience, Innovative Dishes, Good Bartenders","Cafe, Lebanese, Fast Food, Desserts, Beverages, Chinese Memorable Experience, Innovative Dishes, Good Bartenders"
