Restaurent name,Cuisine types,Rating,Price,Distance,Location,what_people_like_about_us,textual_features
Diamond Restaurant And Bar,"North Indian, Mughlai, Rolls, Finger Food",3.9,400.0,2.7,"Civil Lines, Agra","Courteous Staff, Brewed Beer, Delicious Food","North Indian, Mughlai, Rolls, Finger Food Courteous Staff, Brewed Beer, Delicious Food"
Cafe Choco Craze,"Cafe, Shake, Beverages, Pizza, Momos, Fast Food, Waffle, Desserts",3.9,325.0,5.9,"Shahganj, Agra","Satisfying Portions, Seasonal Menu, Trendy Setting","Cafe, Shake, Beverages, Pizza, Momos, Fast Food, Waffle, Desserts Satisfying Portions, Seasonal Menu, Trendy Setting"
Mor Mukut Mithai Wale,Mithai,3.6,125.0,1.4,"Mantola, Agra","Attentive Service, Perfect Place, Main Course","Mithai Attentive Service, Perfect Place, Main Course"
Jeetu Dhaba,"North Indian, Mughlai",3.6,250.0,3.2,"Kamla Nagar, Agra","Great Service, Diverse Menu, Live Sports Screening","North Indian, Mughlai Great Service, Diverse Menu, Live Sports Screening"
Haji Salim Sweet House,"Mithai, Desserts",3.9,200.0,1.7,"Mantola, Agra","Peaceful Ambience, Trendy Setting, Cozy Ambiance","Mithai, Desserts Peaceful Ambience, Trendy Setting, Cozy Ambiance"
Hotel Anjuman,"North Indian, Chinese, Street Food, Fast Food, Seafood, Biryani, Mughlai, Beverages",3.8,300.0,3.2,"Kamla Nagar, Agra","Memorable Experience, Comfortable Seating, Cozy Ambiance","North Indian, Chinese, Street Food, Fast Food, Seafood, Biryani, Mughlai, Beverages Memorable Experience, Comfortable Seating, Cozy Ambiance"
D Delite Vegetarian Restaurant,"North Indian, Chinese, South Indian, Fast Food",3.9,300.0,2.8,"Civil Lines, Agra","Weekend Brunch, Warm Atmosphere, Ambience","North Indian, Chinese, South Indian, Fast Food Weekend Brunch, Warm Atmosphere, Ambience"
Beeryanee,"North Indian, Mughlai",4.2,250.0,3.6,"Khandari, Agra","Attentive Service, Quantity, Staff","North Indian, Mughlai Attentive Service, Quantity, Staff"
Khanaa Khazanaa,"North Indian, Continental, Fast Food",4.0,200.0,5.8,"Dayal Bagh, Agra","Courteous Staff, Variety of Beer, Local Sourcing","North Indian, Continental, Fast Food Courteous Staff, Variety of Beer, Local Sourcing"
New Laziz Chicken Briyani,Biryani,3.2,150.0,3.9,"Shahganj, Agra","Young Crowd, Great for Dates, Diverse Menu","Biryani Young Crowd, Great for Dates, Diverse Menu"
Kings,"Burger, Sandwich, Rolls",3.9,100.0,3.9,"Kamla Nagar, Agra","Trendy Setting, Staff, Innovative Dishes","Burger, Sandwich, Rolls Trendy Setting, Staff, Innovative Dishes"
Drunken Monkey,"Beverages, Juices, Shake, Coffee, Healthy Food, Drinks Only",3.6,225.0,2.5,"Tajganj, Agra","Courteous Staff, Staff, Brewed Beer","Beverages, Juices, Shake, Coffee, Healthy Food, Drinks Only Courteous Staff, Staff, Brewed Beer"
Baba Bakers,"Bakery, Pizza, Burger, Sandwich, Street Food",3.5,150.0,8.9,"Sikandra, Agra","Exquisite Taste, Good Bartenders, Impeccable Presentation","Bakery, Pizza, Burger, Sandwich, Street Food Exquisite Taste, Good Bartenders, Impeccable Presentation"
Distil - The Lounge Bar,"Chinese, North Indian, Beverages",3.9,800.0,2.6,"Civil Lines, Agra","Great for Dates, Good Bartenders, Main Course","Chinese, North Indian, Beverages Great for Dates, Good Bartenders, Main Course"
New Gopal Dhaba,"North Indian, Chinese",3.7,150.0,9.7,"Gopal Pura, Agra","Brewed Beer, Friendly Staff, Diverse Menu","North Indian, Chinese Brewed Beer, Friendly Staff, Diverse Menu"
Tandoori Flames,"Rolls, North Indian, Momos, Pasta, Sandwich, Fast Food, Chinese",3.9,200.0,4.7,"Tajganj, Agra","Courteous Staff, Great for Dates, Brewed Beer","Rolls, North Indian, Momos, Pasta, Sandwich, Fast Food, Chinese Courteous Staff, Great for Dates, Brewed Beer"
AJ's Cafe & Bakery,"Bakery, Desserts, Fast Food, Pizza, Beverages",3.2,250.0,2.4,"Agra Cantt, Agra","Main Course, Good Bartenders, Live Sports Screening","Bakery, Desserts, Fast Food, Pizza, Beverages Main Course, Good Bartenders, Live Sports Screening"
Laxman Fast Food,Fast Food,3.5,100.0,2.8,"Civil Lines, Agra","Quantity, Weekend Brunch, Impeccable Presentation","Fast Food Quantity, Weekend Brunch, Impeccable Presentation"
20-20 Fast Food,"South Indian, Fast Food, Momos",3.9,75.0,5.1,"Dayal Bagh, Agra","Vintage Decor, Good Bartenders, Inviting Decor","South Indian, Fast Food, Momos Vintage Decor, Good Bartenders, Inviting Decor"
Shri Kanha Foods,North Indian,3.5,150.0,3.5,"Agra Cantt, Agra","Cozy Ambiance, Ambiance, Attentive Service","North Indian Cozy Ambiance, Ambiance, Attentive Service"
Jux Pux,"Fast Food, Shake, Waffle, Beverages",3.1,150.0,2.7,"Civil Lines, Agra","Customizable Dishes, Quantity, Hospitality","Fast Food, Shake, Waffle, Beverages Customizable Dishes, Quantity, Hospitality"
Xhale,"Chinese, Italian, Fast Food, Rolls, Beverages",3.9,250.0,2.2,"Agra Cantt, Agra","Authentic Flavors, Good Music, Innovative Dishes","Chinese, Italian, Fast Food, Rolls, Beverages Authentic Flavors, Good Music, Innovative Dishes"
B&B Restro,"North Indian, South Indian, Fast Food, Chinese, Beverages, Street Food, Pizza, Pasta",3.8,250.0,4.4,"Tajganj, Agra","Efficient Service, Customizable Dishes, Great Service","North Indian, South Indian, Fast Food, Chinese, Beverages, Street Food, Pizza, Pasta Efficient Service, Customizable Dishes, Great Service"
Mercury Cafe,"Cafe, Sandwich, Fast Food, Burger, Pizza, Desserts, Beverages",3.6,400.0,4.4,"Tajganj, Agra","Breakfast, Young Crowd, Impeccable Presentation","Cafe, Sandwich, Fast Food, Burger, Pizza, Desserts, Beverages Breakfast, Young Crowd, Impeccable Presentation"
Mothers Milkshakes,"Beverages, Fast Food, Desserts",3.9,150.0,4.4,"Civil Lines, Agra","Hospitality, Clean Environment, Good Bartenders","Beverages, Fast Food, Desserts Hospitality, Clean Environment, Good Bartenders"
The Greens Restaurant & Herbal Cafe,"North Indian, South Indian, Chinese, Continental",3.6,400.0,1.5,"Rakabganj, Agra","Hospitality, Perfect Place, Trendy Setting","North Indian, South Indian, Chinese, Continental Hospitality, Perfect Place, Trendy Setting"
Street 36,"North Indian, Beverages",3.6,75.0,2.7,"Khandari, Agra","Impeccable Presentation, Well-priced Options, Young Crowd","North Indian, Beverages Impeccable Presentation, Well-priced Options, Young Crowd"
Brij Thali,North Indian,3.6,100.0,1.6,"Civil Lines, Agra","Brewed Beer, Impeccable Presentation, Good Music","North Indian Brewed Beer, Impeccable Presentation, Good Music"
Agra Fast Food And Restaurant,"North Indian, South Indian",2.6,200.0,3.3,"Tajganj, Agra","Flavorful Creations, Weekend Brunch, Consistent Quality","North Indian, South Indian Flavorful Creations, Weekend Brunch, Consistent Quality"
Jawahar Hotel,North Indian,3.6,200.0,4.2,"Dayal Bagh, Agra","Hospitable Staff, Weekend Brunch, Staff","North Indian Hospitable Staff, Weekend Brunch, Staff"
Shri Mangalam Dhabha,North Indian,3.6,250.0,6.6,"Sikandra, Agra","Friendly Staff, Breakfast, Good Music","North Indian Friendly Staff, Breakfast, Good Music"
Hunger On Wheel Cafe,"Fast Food, Chinese, Desserts",3.8,150.0,4.1,"Civil Lines, Agra","Cozy Ambiance, Vintage Decor, Satisfying Portions","Fast Food, Chinese, Desserts Cozy Ambiance, Vintage Decor, Satisfying Portions"
Yo Yo Foods,"North Indian, Chinese, Pizza, Sandwich, Fast Food, Street Food, South Indian, Shake",3.7,200.0,6.4,"Shahganj, Agra","Memorable Experience, Ambience, Inviting Decor","North Indian, Chinese, Pizza, Sandwich, Fast Food, Street Food, South Indian, Shake Memorable Experience, Ambience, Inviting Decor"
Mr Dosa,"South Indian, Chinese, Pizza, Sandwich, Fast Food, Street Food, Shake, Beverages",3.9,250.0,2.4,"Agra Cantt, Agra","Fresh Ingredients, Ambiance, Delicious Food","South Indian, Chinese, Pizza, Sandwich, Fast Food, Street Food, Shake, Beverages Fresh Ingredients, Ambiance, Delicious Food"
Kathi Express,"Rolls, Shawarma, Kebab, Shake",3.8,100.0,1.4,"Mantola, Agra","Great Service, Local Sourcing, Customizable Dishes","Rolls, Shawarma, Kebab, Shake Great Service, Local Sourcing, Customizable Dishes"
Vada Pav King,"Maharashtrian, Street Food, Burger, Sandwich, Rolls, Fast Food, Beverages",3.5,175.0,4.3,"Tajganj, Agra","Weekend Brunch, Local Sourcing, Brewed Beer","Maharashtrian, Street Food, Burger, Sandwich, Rolls, Fast Food, Beverages Weekend Brunch, Local Sourcing, Brewed Beer"
Paatra - Jaypee Palace Hotel,"North Indian, Mughlai",4.3,1500.0,4.4,"Jaypee Palace Hotel, Tajganj, Agra","Inviting Decor, Local Sourcing, Ambiance","North Indian, Mughlai Inviting Decor, Local Sourcing, Ambiance"
Chai Janeman,"Shake, Beverages, Sandwich, Burger, Street Food, Fast Food",3.0,125.0,7.8,"Sikandra, Agra","Cafe, Innovative Dishes, Good Music","Shake, Beverages, Sandwich, Burger, Street Food, Fast Food Cafe, Innovative Dishes, Good Music"
Meals Cafe,"Fast Food, Pizza, Wraps, Sandwich",4.3,250.0,3.5,"Civil Lines, Agra","Consistent Quality, Innovative Dishes, Peaceful Ambience","Fast Food, Pizza, Wraps, Sandwich Consistent Quality, Innovative Dishes, Peaceful Ambience"
Barbeque Pizza Junction,"BBQ, Pizza, Burger, Wraps, Sandwich, Momos, Shake, Beverages",3.6,150.0,2.2,"Civil Lines, Agra","Cozy Ambiance, Fresh Ingredients, Peaceful Ambience","BBQ, Pizza, Burger, Wraps, Sandwich, Momos, Shake, Beverages Cozy Ambiance, Fresh Ingredients, Peaceful Ambience"
Momos Adda,"Street Food, Fast Food, Burger, Momos, Pizza",3.4,100.0,6.3,"Sikandra, Agra","Variety of Beer, Good Bartenders, Memorable Experience","Street Food, Fast Food, Burger, Momos, Pizza Variety of Beer, Good Bartenders, Memorable Experience"
Spice Kitchen,"North Indian, Chinese",3.8,400.0,8.4,"Sikandra, Agra","Weekend Brunch, Impeccable Presentation, Seasonal Menu","North Indian, Chinese Weekend Brunch, Impeccable Presentation, Seasonal Menu"
The Chamber - Kitchen & Taproom,"North Indian, Chinese, Italian, Fast Food, Beverages, Desserts",4.0,600.0,4.4,"Tajganj, Agra","Delicious Food, Young Crowd, Courteous Staff","North Indian, Chinese, Italian, Fast Food, Beverages, Desserts Delicious Food, Young Crowd, Courteous Staff"
European Bakery,"Bakery, Desserts",3.7,150.0,2.9,"Civil Lines, Agra","Live Sports Screening, Weekend Brunch, Good Bartenders","Bakery, Desserts Live Sports Screening, Weekend Brunch, Good Bartenders"
Brijwasi Petha,Mithai,3.5,100.0,1.6,"Rakabganj, Agra","Weekend Brunch, Trendy Setting, Courteous Staff","Mithai Weekend Brunch, Trendy Setting, Courteous Staff"
Prince Of Spice,"North Indian, Mughlai, Chinese",3.3,375.0,4.3,"Tajganj, Agra","Memorable Experience, Great for Dates, Warm Atmosphere","North Indian, Mughlai, Chinese Memorable Experience, Great for Dates, Warm Atmosphere"
Desi Masala,"Chinese, Fast Food",3.9,175.0,1.2,"Rakabganj, Agra","Ambience, Cafe, Variety of Beer","Chinese, Fast Food Ambience, Cafe, Variety of Beer"
Agra Burger Club,"Burger, Fast Food, Sandwich, Pasta, Chinese, Beverages",3.3,200.0,5.0,"Shahganj, Agra","Cafe, Breakfast, Sustainable Practices","Burger, Fast Food, Sandwich, Pasta, Chinese, Beverages Cafe, Breakfast, Sustainable Practices"
Shri Mohan Hotel,North Indian,3.1,150.0,0.355,"Rakabganj, Agra","Quantity, Live Sports Screening, Innovative Dishes","North Indian Quantity, Live Sports Screening, Innovative Dishes"
Big Crust,"Pizza, Pasta, Shake, Desserts, Fast Food",3.0,250.0,3.7,"Khandari, Agra","Impeccable Presentation, Great for Dates, Quantity","Pizza, Pasta, Shake, Desserts, Fast Food Impeccable Presentation, Great for Dates, Quantity"
Heart Of Taj Cafe,"North Indian, Mughlai, Chinese, Fast Food, Biryani, Street Food",2.9,200.0,3.8,"Tajganj, Agra","Flavorful Creations, Clean Environment, Live Sports Screening","North Indian, Mughlai, Chinese, Fast Food, Biryani, Street Food Flavorful Creations, Clean Environment, Live Sports Screening"
Amrut Restaurant,Chinese,3.1,150.0,4.1,"Dayal Bagh, Agra","Trendy Setting, Brewed Beer, Weekend Brunch","Chinese Trendy Setting, Brewed Beer, Weekend Brunch"
Hotel Taj Plaza,"North Indian, Fast Food, Beverages, Chinese",3.6,250.0,4.6,"Tajganj, Agra","Well-priced Options, Seasonal Menu, Peaceful Ambience","North Indian, Fast Food, Beverages, Chinese Well-priced Options, Seasonal Menu, Peaceful Ambience"
Pizza House Family Restaurant,"Pizza, Burger, Sandwich, Fast Food, Chinese, Shake, Beverages",3.4,175.0,5.8,"Shahganj, Agra","Sustainable Practices, Authentic Flavors, Clean Environment","Pizza, Burger, Sandwich, Fast Food, Chinese, Shake, Beverages Sustainable Practices, Authentic Flavors, Clean Environment"
Karan Restaurant,"Chinese, North Indian, Fast Food, Continental, Beverages, Desserts",3.9,600.0,2.5,"Hotel Ganga Ratan, Tajganj, Agra","Inviting Decor, Ambiance, Young Crowd","Chinese, North Indian, Fast Food, Continental, Beverages, Desserts Inviting Decor, Ambiance, Young Crowd"
Shivam Restaurant,"North Indian, Fast Food",3.8,250.0,3.2,"Tajganj, Agra","Hospitality, Consistent Quality, Customizable Dishes","North Indian, Fast Food Hospitality, Consistent Quality, Customizable Dishes"
Tandoori Night,"North Indian, Fast Food, Chinese, South Indian, Rolls",3.8,300.0,6.4,"Sikandra, Agra","Inviting Decor, Ambiance, Flavorful Creations","North Indian, Fast Food, Chinese, South Indian, Rolls Inviting Decor, Ambiance, Flavorful Creations"
Freaky Burger,"Burger, Fast Food, Beverages, Pizza, Sandwich",3.4,225.0,5.8,"Tajganj, Agra","Staff, Good Music, Weekend Brunch","Burger, Fast Food, Beverages, Pizza, Sandwich Staff, Good Music, Weekend Brunch"
Best Cake Bakers,"Bakery, Fast Food, Desserts, Shake",3.5,200.0,5.0,"Tajganj, Agra","Great for Dates, Extensive Mocktail Menu, Seasonal Menu","Bakery, Fast Food, Desserts, Shake Great for Dates, Extensive Mocktail Menu, Seasonal Menu"
Wok To Fork,"Fast Food, Beverages",3.8,100.0,2.4,"Civil Lines, Agra","Fresh Ingredients, Exquisite Taste, Clean Environment","Fast Food, Beverages Fresh Ingredients, Exquisite Taste, Clean Environment"
Arabian Bites,"Burger, Fast Food",3.5,125.0,4.8,"Tajganj, Agra","Diverse Menu, Well-priced Options, Extensive Mocktail Menu","Burger, Fast Food Diverse Menu, Well-priced Options, Extensive Mocktail Menu"
YED Foods,"North Indian, Fast Food",3.9,100.0,3.2,"Civil Lines, Agra","Hospitality, Friendly Staff, Young Crowd","North Indian, Fast Food Hospitality, Friendly Staff, Young Crowd"
Banarasi Kitchen,"Street Food, Chinese, North Indian",3.9,250.0,8.3,"Sikandra, Agra","Peaceful Ambience, Courteous Staff, Perfect Place","Street Food, Chinese, North Indian Peaceful Ambience, Courteous Staff, Perfect Place"
Chanchal Hotel,North Indian,2.9,150.0,3.5,"Agra Cantt, Agra","Great for Dates, Flavorful Creations, Friendly Staff","North Indian Great for Dates, Flavorful Creations, Friendly Staff"
The Momo Heaven,"Fast Food, Momos, Beverages",3.5,125.0,1.2,"Civil Lines, Agra","Breakfast, Innovative Dishes, Cozy Ambiance","Fast Food, Momos, Beverages Breakfast, Innovative Dishes, Cozy Ambiance"
The Global Savour,"North Indian, Chinese, Fast Food, Street Food",4.0,400.0,3.8,"Tajganj, Agra","Warm Atmosphere, Consistent Quality, Great for Dates","North Indian, Chinese, Fast Food, Street Food Warm Atmosphere, Consistent Quality, Great for Dates"
Kitchen On Fire,"North Indian, Mughlai, Fast Food",3.3,250.0,2.5,"Civil Lines, Agra","Authentic Flavors, Brewed Beer, Friendly Staff","North Indian, Mughlai, Fast Food Authentic Flavors, Brewed Beer, Friendly Staff"
Shri Anand  Sakahari Bhojan,North Indian,3.1,175.0,2.7,"Civil Lines, Agra","Friendly Staff, Live Sports Screening, Trendy Setting","North Indian Friendly Staff, Live Sports Screening, Trendy Setting"
Tarachand Dhaba,North Indian,3.8,125.0,1.1,"Civil Lines, Agra","Courteous Staff, Cafe, Satisfying Portions","North Indian Courteous Staff, Cafe, Satisfying Portions"
Chicken Point,"North Indian, Biryani, Rolls, Chinese",3.7,325.0,6.3,"Trans Yamuna, Agra","Sophisticated, Innovative Dishes, Attentive Service","North Indian, Biryani, Rolls, Chinese Sophisticated, Innovative Dishes, Attentive Service"
UK Restaurants And Kitchens,"North Indian, Chinese, Biryani, Kebab",3.6,250.0,4.5,"Mangal City Mall, Vijay Nagar, Indore","Sustainable Practices, Good Music, Local Sourcing","North Indian, Chinese, Biryani, Kebab Sustainable Practices, Good Music, Local Sourcing"
Dopamine,"Asian, North Indian, Continental, Italian, Bar Food, Pizza, Sushi, Salad",4.5,750.0,5.3,"Vijay Nagar, Indore","Comfortable Seating, Staff, Memorable Experience","Asian, North Indian, Continental, Italian, Bar Food, Pizza, Sushi, Salad Comfortable Seating, Staff, Memorable Experience"
Epicentre - The Park,"Continental, Salad, Chinese, Asian, Italian, North Indian, Desserts, Beverages",4.2,1750.0,8.0,"The Park, Indore","Cafe, Delicious Food, Efficient Service","Continental, Salad, Chinese, Asian, Italian, North Indian, Desserts, Beverages Cafe, Delicious Food, Efficient Service"
House Of Malts,"North Indian, Chinese, Continental, Italian, Oriental, Bar Food, Beverages",3.8,500.0,5.6,"Vijay Nagar, Indore","Fresh Ingredients, Perfect Place, Staff","North Indian, Chinese, Continental, Italian, Oriental, Bar Food, Beverages Fresh Ingredients, Perfect Place, Staff"
The Piano Project,"North Indian, Mughlai, Kebab, Biryani, Beverages",4.5,1000.0,4.9,"Vijay Nagar, Indore","Inviting Decor, Seasonal Menu, Peaceful Ambience","North Indian, Mughlai, Kebab, Biryani, Beverages Inviting Decor, Seasonal Menu, Peaceful Ambience"
Aqua - The Park,"North Indian, Asian, Continental, Oriental",4.5,1100.0,8.0,"The Park, Indore","Seasonal Menu, Courteous Staff, Clean Environment","North Indian, Asian, Continental, Oriental Seasonal Menu, Courteous Staff, Clean Environment"
Kabelo Veg Barbecues,"North Indian, Salad, Desserts, Beverages",4.3,600.0,4.5,"Vijay Nagar, Indore","Inviting Decor, Exquisite Taste, Ambience","North Indian, Salad, Desserts, Beverages Inviting Decor, Exquisite Taste, Ambience"
Flame By Fire & Smoke,"North Indian, Chinese, Seafood, Biryani, Oriental, Desserts",4.4,500.0,4.2,"Vijay Nagar, Indore","Well-priced Options, Delicious Food, Cafe","North Indian, Chinese, Seafood, Biryani, Oriental, Desserts Well-priced Options, Delicious Food, Cafe"
Cream Centre,"North Indian, Chinese, Italian, Mexican, Fast Food, Ice Cream, Shake, Beverages",4.2,700.0,4.6,"Vijay Nagar, Indore","Delicious Food, Hospitable Staff, Attentive Service","North Indian, Chinese, Italian, Mexican, Fast Food, Ice Cream, Shake, Beverages Delicious Food, Hospitable Staff, Attentive Service"
Cravings - Sayaji Hotel,"North Indian, Chinese, Italian, Beverages",4.5,900.0,4.4,"Sayaji Hotel, Vijay Nagar, Indore","Satisfying Portions, Consistent Quality, Ambience","North Indian, Chinese, Italian, Beverages Satisfying Portions, Consistent Quality, Ambience"
Barbeque Nation,"North Indian, BBQ, Biryani, Kebab, Continental, Chinese, Beverages, Desserts",4.3,750.0,2.3,"South Tukoganj, Indore","Consistent Quality, Sustainable Practices, Breakfast","North Indian, BBQ, Biryani, Kebab, Continental, Chinese, Beverages, Desserts Consistent Quality, Sustainable Practices, Breakfast"
The Creative Kitchen - Radisson Blu Hotel,"North Indian, Continental, Chinese, Asian, Desserts",4.0,1250.0,5.5,"Radisson Blu Hotel, Vijay Nagar, Indore","Diverse Menu, Ambience, Staff","North Indian, Continental, Chinese, Asian, Desserts Diverse Menu, Ambience, Staff"
Fire & Smoke,"North Indian, Mughlai, Continental",4.9,1100.0,8.9,"By Pass Road (North), Indore","Variety of Beer, Local Sourcing, Ambiance","North Indian, Mughlai, Continental Variety of Beer, Local Sourcing, Ambiance"
Revolution Indore,"North Indian, Continental, Fast Food, Pizza, Burger, Sandwich, Italian, Beverages",4.1,1000.0,4.9,"Vijay Nagar, Indore","Local Sourcing, Friendly Staff, Ambience","North Indian, Continental, Fast Food, Pizza, Burger, Sandwich, Italian, Beverages Local Sourcing, Friendly Staff, Ambience"
The Cube - Hotel Effotel,"North Indian, Mughlai, Asian, Biryani, Desserts",4.9,600.0,5.5,"Hotel Effotel, Vijay Nagar, Indore","Live Sports Screening, Well-priced Options, Cafe","North Indian, Mughlai, Asian, Biryani, Desserts Live Sports Screening, Well-priced Options, Cafe"
Chopstick City - Sayaji Hotel,"Chinese, Asian, Beverages, Desserts",4.7,900.0,4.4,"Sayaji Hotel, Vijay Nagar, Indore","Diverse Menu, Great for Dates, Live Sports Screening","Chinese, Asian, Beverages, Desserts Diverse Menu, Great for Dates, Live Sports Screening"
Municipal,"North Indian, Continental",4.2,750.0,5.1,"Mangal City Mall, Vijay Nagar, Indore","Authentic Flavors, Main Course, Live Sports Screening","North Indian, Continental Authentic Flavors, Main Course, Live Sports Screening"
Mama Loca,"Pizza, Pasta, Italian, Continental, Shawarma, Middle Eastern, Lebanese, Greek",4.2,500.0,2.8,"New Palasia, Indore","Cozy Ambiance, Young Crowd, Breakfast","Pizza, Pasta, Italian, Continental, Shawarma, Middle Eastern, Lebanese, Greek Cozy Ambiance, Young Crowd, Breakfast"
Indore Kitchen - Indore Marriott Hotel,"North Indian, Asian",4.2,1000.0,4.2,"Indore Marriott Hotel, Vijay Nagar, Indore","Great for Dates, Warm Atmosphere, Peaceful Ambience","North Indian, Asian Great for Dates, Warm Atmosphere, Peaceful Ambience"
The Ashoka Hotel And Multi-Cuisine Restaurant,"North Indian, Chinese, Continental, Fast Food, Street Food, Salad, Shake, Beverages",4.2,350.0,4.5,"Vijay Nagar, Indore","Young Crowd, Breakfast, Cozy Ambiance","North Indian, Chinese, Continental, Fast Food, Street Food, Salad, Shake, Beverages Young Crowd, Breakfast, Cozy Ambiance"
Punjab Grill,"North Indian, Mughlai, Kebab, Biryani, Desserts",4.5,1250.0,8.4,"By Pass Road (North), Indore","Great for Dates, Exquisite Taste, Variety of Beer","North Indian, Mughlai, Kebab, Biryani, Desserts Great for Dates, Exquisite Taste, Variety of Beer"
Ni Hao - Radisson Blu Hotel,"Asian, Chinese, Thai, Desserts",4.4,1800.0,5.5,"Radisson Blu Hotel, Vijay Nagar, Indore","Cafe, Hospitality, Weekend Brunch","Asian, Chinese, Thai, Desserts Cafe, Hospitality, Weekend Brunch"
Alba Bistro,"North Indian, Cafe, Salad, Fast Food, Coffee, Pizza, Desserts, Shake",4.5,600.0,4.2,"Vijay Nagar, Indore","Staff, Trendy Setting, Impeccable Presentation","North Indian, Cafe, Salad, Fast Food, Coffee, Pizza, Desserts, Shake Staff, Trendy Setting, Impeccable Presentation"
Blue Salt & Coffee - Hotel Essentia,"North Indian, South Indian, Continental, Chinese, Fast Food, Street Food, Desserts, Beverages",3.8,1250.0,4.9,"Khajrana, Indore","Exquisite Taste, Flavorful Creations, Seasonal Menu","North Indian, South Indian, Continental, Chinese, Fast Food, Street Food, Desserts, Beverages Exquisite Taste, Flavorful Creations, Seasonal Menu"
Terazza,"Cafe, North Indian, Italian, Fast Food, Beverages",3.9,450.0,4.2,"Vijay Nagar, Indore","Brewed Beer, Satisfying Portions, Inviting Decor","Cafe, North Indian, Italian, Fast Food, Beverages Brewed Beer, Satisfying Portions, Inviting Decor"
Bhopal Bake House And Cafe,"Bakery, Desserts, Continental, Fast Food, Street Food, Beverages",4.8,300.0,3.9,"Old Palasia, Indore","Memorable Experience, Efficient Service, Delicious Food","Bakery, Desserts, Continental, Fast Food, Street Food, Beverages Memorable Experience, Efficient Service, Delicious Food"
Sanchi - Pan Indian | Fine Dine,"North Indian, Mughlai, Chinese, Biryani, Desserts",3.8,750.0,4.4,"Sayaji Hotel, Vijay Nagar, Indore","Good Bartenders, Variety of Beer, Delicious Food","North Indian, Mughlai, Chinese, Biryani, Desserts Good Bartenders, Variety of Beer, Delicious Food"
Farzi Café,"North Indian, Continental, Pizza, Bar Food, Biryani, Beverages, Desserts",4.3,1200.0,4.9,"Vijay Nagar, Indore","Good Music, Young Crowd, Vintage Decor","North Indian, Continental, Pizza, Bar Food, Biryani, Beverages, Desserts Good Music, Young Crowd, Vintage Decor"
Mamagoto,Asian,4.5,500.0,8.5,"By Pass Road (North), Indore","Clean Environment, Inviting Decor, Young Crowd","Asian Clean Environment, Inviting Decor, Young Crowd"
Pind Balluchi,"North Indian, Mughlai, Biryani, Kebab, Bar Food, Desserts, Beverages",4.0,500.0,5.1,"Vijay Nagar, Indore","Extensive Mocktail Menu, Sustainable Practices, Variety of Beer","North Indian, Mughlai, Biryani, Kebab, Bar Food, Desserts, Beverages Extensive Mocktail Menu, Sustainable Practices, Variety of Beer"
Hobnob Gourmet Cafébar,"Continental, Italian, North Indian, Bar Food, Salad, Beverages",4.4,1300.0,5.7,"Infiniti Hotel, Vijay Nagar, Indore","Diverse Menu, Consistent Quality, Ambiance","Continental, Italian, North Indian, Bar Food, Salad, Beverages Diverse Menu, Consistent Quality, Ambiance"
Ring Road Social,"North Indian, Chinese, Biryani, Pizza, Burger, Fast Food, Desserts, Beverages",4.5,750.0,5.6,"Vijay Nagar, Indore","Quantity, Customizable Dishes, Hospitable Staff","North Indian, Chinese, Biryani, Pizza, Burger, Fast Food, Desserts, Beverages Quantity, Customizable Dishes, Hospitable Staff"
The State - Lounge Bar,"North Indian, Continental, Kebab, Chinese, Sandwich, Fast Food, Biryani, Desserts",4.2,900.0,5.3,"Vijay Nagar, Indore","Quantity, Innovative Dishes, Breakfast","North Indian, Continental, Kebab, Chinese, Sandwich, Fast Food, Biryani, Desserts Quantity, Innovative Dishes, Breakfast"
Ozone Wine & Dine,"North Indian, Continental, Mughlai, Kebab, Biryani, Fast Food, Desserts",3.8,600.0,4.9,"Khajrana, Indore","Fresh Ingredients, Peaceful Ambience, Hospitality","North Indian, Continental, Mughlai, Kebab, Biryani, Fast Food, Desserts Fresh Ingredients, Peaceful Ambience, Hospitality"
Split Bean,"North Indian, Chinese, Pizza, Pasta, Fast Food, Ice Cream, Desserts, Shake",3.5,500.0,5.6,"MR 10 Road, Indore","Seasonal Menu, Efficient Service, Variety of Beer","North Indian, Chinese, Pizza, Pasta, Fast Food, Ice Cream, Desserts, Shake Seasonal Menu, Efficient Service, Variety of Beer"
WOW! Momo,"Momos, Fast Food, Chinese, Tibetan, Sichuan, Beverages, Desserts",4.1,175.0,3.1,"Sapna Sangeeta, Indore","Innovative Dishes, Flavorful Creations, Efficient Service","Momos, Fast Food, Chinese, Tibetan, Sichuan, Beverages, Desserts Innovative Dishes, Flavorful Creations, Efficient Service"
